{
  "$schema": "http://json-schema.org/draft-07/schema#",
  "$id": "waiver-schema.json",
  "title": "Waiver",
  "description": "Schema for a time-bound policy exception waiver.",
  "type": "object",
  "required": [
    "waiver_id",
    "policy_id",
    "resource",
    "justification",
    "approver",
    "expiration_date",
    "created_at"
  ],
  "properties": {
    "waiver_id": {
      "type": "string",
      "description": "Unique identifier for the waiver (UUID).",
      "minLength": 1
    },
    "policy_id": {
      "type": "string",
      "description": "The policy this waiver applies to (matches Rego policy name).",
      "minLength": 1
    },
    "resource": {
      "type": "string",
      "description": "The resource identifier this waiver covers.",
      "minLength": 1
    },
    "justification": {
      "type": "string",
      "description": "Reason for the exception.",
      "minLength": 1
    },
    "approver": {
      "type": "string",
      "description": "Email or GitHub handle of the approver.",
      "minLength": 1
    },
    "expiration_date": {
      "type": "string",
      "description": "ISO 8601 date when the waiver expires.",
      "format": "date"
    },
    "created_at": {
      "type": "string",
      "description": "ISO 8601 datetime when the waiver was created.",
      "format": "date-time"
    }
  },
  "additionalProperties": false
}
