{
  "waiver_id": "f9e8d7c6-5432-4abc-9876-fedcba098765",
  "policy_id": "no_open_security_group",
  "resource": "aws_security_group.app_sg",
  "justification": "Legacy ingress rule required during network migration — expired",
  "approver": "security-lead@company.com",
  "expiration_date": "2026-06-29",
  "created_at": "2026-03-31T02:05:58Z"
}
